{
  "schema_version": "2.2",
  "id": "2026-07-J-10",
  "meta": {
    "month": "2026-07-J",
    "sequence": 10,
    "subject": "과학",
    "linked_unit": "생명과학I III-2 유전 형질과 돌연변이",
    "part_ko": "어긋난 글자가 만든 변화",
    "achievement_standard": "12생과03-03",
    "achievement_verified": true,
    "difficulty": "중간",
    "cognitive_skill": "요지",
    "lexile": "1010L",
    "ar_level": 6.9,
    "key_concepts": [
      "유전자",
      "돌연변이",
      "형질",
      "변이와 진화"
    ]
  },
  "page1": {
    "title": "The Typos That Shaped Every Living Thing",
    "subtitle": "Why a single changed letter can matter so much.",
    "body": "Your body runs on a set of instructions written in a four-letter chemical alphabet. These instructions are copied faithfully every time a cell divides. But no copying machine is perfect, and once in a while a single letter is changed, dropped, or added. We call such a change a <u>mutation</u>, and despite its frightening reputation, it is simply <u>a typo in the genetic text</u>. Most of these typos are harmless, landing in a spot where the meaning barely shifts.\n\nThe real effect of a mutation depends almost entirely on where it falls and what it happens to touch. A change in a long, unused stretch of DNA may quietly do nothing at all. But a change in one crucial instruction can alter an important protein. That can reshape a visible trait, and sometimes even cause serious disease. Yet the very same process is also the quiet engine of variety. Once in a great while, a random change happens to be useful, giving its owner a tiny advantage in survival. Over countless generations, such rare lucky <mark>errors</mark> build up, and this is the raw material on which evolution slowly works. A small change in fur color, for instance, might hide an animal better from a hunting predator. Across thousands of years, that tiny edge can reshape an entire species.\n\nThis double nature is what makes mutation so striking. The very same blind, mindless process that can quietly break a healthy body is also the only true source of genuinely new traits. It is the deep reason life is not frozen but endlessly inventive. Without faithful copying, life simply could not continue at all. Yet without occasional copying mistakes, it could never <blank>. Perfection and progress, it quietly turns out, pull in opposite directions.",
    "illustration": "../../assets/illustrations/2026-07-J/10.jpg",
    "illustration_caption": "A mutation is a typo in the genetic text — sometimes harmful, sometimes the seed of something new.",
    "gloss_extra": [
      { "term": "protein", "ko": "단백질" },
      { "term": "trait", "ko": "형질, 특성" },
      { "term": "evolution", "ko": "진화" }
    ]
  },
  "page2": {
    "questions": [
      {
        "type": "mock_objective",
        "style": "요지",
        "stem": "다음 글의 요지로 가장 적절한 것은?",
        "choices": [
          "Mutations are always harmful and should be feared.",
          "Genetic instructions are copied so perfectly that mutations never occur.",
          "A mutation can harm a body but is also the source of new traits for evolution.",
          "Every mutation changes a visible trait in a major way.",
          "Evolution would work better if mutations never happened."
        ],
        "answer_index": 2
      },
      {
        "type": "mock_objective",
        "style": "빈칸 추론",
        "stem": "윗글의 밑줄 친 빈칸에 들어갈 말로 가장 적절한 것은?",
        "choices": [
          "stop",
          "repeat",
          "rest",
          "change",
          "freeze"
        ],
        "answer_index": 3
      },
      {
        "type": "mock_objective",
        "style": "함의 추론",
        "stem": "윗글의 밑줄 친 표현 a typo in the genetic text 가 의미하는 바로 가장 적절한 것은?",
        "choices": [
          "mutations are caused by careless human writers",
          "the genetic code has no meaning at all",
          "genetic text is written in real ink on paper",
          "mutations only appear in printed books about biology",
          "a mutation is a small change in copied DNA"
        ],
        "answer_index": 4
      },
      {
        "type": "school_descriptive",
        "style": "요약문 빈칸 완성",
        "prompt": "다음은 본문의 요약문이다. 본문의 내용을 바탕으로 빈칸 (A), (B)에 들어갈 말을 <조건>에 맞게 영어 한 단어로 각각 쓰시오. <조건> 본문에서 제시된 단어를 그대로 활용할 것.",
        "hints": [
          "mutation",
          "copying",
          "trait",
          "variety",
          "evolution"
        ],
        "summary_template": "A <blank> (A) is a change that appears when DNA is copied. It can harm a body, yet rare useful changes create the variety that <blank> (B) depends on.",
        "model_answer": "(A) mutation  (B) evolution"
      }
    ],
    "textbook_tieback": {
      "unit_label": "생명과학I III · 유전 형질과 돌연변이",
      "body_ko": "고2 생명과학I에서는 유전 형질과 돌연변이를 배운다. 유전 정보(DNA)는 세포 분열 때마다 복제되는데, 복제는 완벽하지 않아 가끔 염기 하나가 바뀌거나 빠지거나 더해진다 — 이를 돌연변이라 한다. 돌연변이의 효과는 그것이 '어디에' 일어나는가에 달려 있다. 쓰이지 않는 부위라면 영향이 거의 없지만, 중요한 유전자에 일어나면 단백질이 바뀌어 형질이 달라지거나 질병을 일으킬 수 있다. 그러나 같은 과정이 변이의 원천이기도 하다 — 드물게 유익한 변이가 생기면 생존에 작은 이점을 주고, 여러 세대에 걸쳐 쌓여 진화의 재료가 된다. 즉 돌연변이는 해로움과 새로움이라는 양면을 지니며, 복제 오류 없이는 생명이 변화할 수 없다.",
      "tags": [
        "유전자",
        "돌연변이",
        "형질변화",
        "변이와진화"
      ],
      "visual_aid": {
        "type": "emoji_flow",
        "title": "돌연변이의 두 얼굴",
        "steps": [
          {
            "emoji": "🧬",
            "label": "복제",
            "note": "4글자 알파벳"
          },
          {
            "emoji": "✏️",
            "label": "오타=돌연변이",
            "note": "글자 바뀜"
          },
          {
            "emoji": "⚠️",
            "label": "위치에 따라",
            "note": "무해/질병"
          },
          {
            "emoji": "🌱",
            "label": "드문 유익",
            "note": "진화의 재료"
          }
        ]
      }
    }
  },
  "page3": {
    "sentences": [
      {
        "index": 1,
        "segments": [
          {
            "role": "S",
            "text": "Your body"
          },
          {
            "role": "V",
            "text": "runs"
          },
          {
            "role": "M",
            "text": "on a set of instructions written in a four-letter chemical alphabet.",
            "note": "과거분사 수식"
          }
        ],
        "grammar_note": "run on + 과거분사 수식"
      },
      {
        "index": 2,
        "segments": [
          {
            "role": "S",
            "text": "These instructions"
          },
          {
            "role": "V",
            "text": "are copied",
            "note": "수동태"
          },
          {
            "role": "M",
            "text": "faithfully every time a cell divides.",
            "note": "every time 접속사"
          }
        ],
        "grammar_note": "수동태 + every time 접속사"
      },
      {
        "index": 3,
        "segments": [
          {
            "role": "CONJ",
            "text": "But"
          },
          {
            "role": "S",
            "text": "no copying machine"
          },
          {
            "role": "V",
            "text": "is"
          },
          {
            "role": "C",
            "text": "perfect,"
          },
          {
            "role": "CONJ",
            "text": "and"
          },
          {
            "role": "M",
            "text": "once in a while"
          },
          {
            "role": "S",
            "text": "a single letter"
          },
          {
            "role": "V",
            "text": "is changed, dropped, or added.",
            "note": "수동태 병렬"
          }
        ],
        "grammar_note": "2형식 + and + 수동태 병렬"
      },
      {
        "index": 4,
        "segments": [
          {
            "role": "S",
            "text": "We"
          },
          {
            "role": "V",
            "text": "call"
          },
          {
            "role": "O",
            "text": "such a change"
          },
          {
            "role": "C",
            "text": "a mutation,",
            "note": "call O C"
          },
          {
            "role": "CONJ",
            "text": "and"
          },
          {
            "role": "M",
            "text": "despite its frightening reputation,",
            "note": "despite"
          },
          {
            "role": "S",
            "text": "it"
          },
          {
            "role": "V",
            "text": "is"
          },
          {
            "role": "C",
            "text": "simply a typo in the genetic text."
          }
        ],
        "grammar_note": "call O C + despite + 2형식"
      },
      {
        "index": 5,
        "segments": [
          {
            "role": "S",
            "text": "Most of these typos"
          },
          {
            "role": "V",
            "text": "are"
          },
          {
            "role": "C",
            "text": "harmless,"
          },
          {
            "role": "V",
            "text": "landing",
            "note": "분사구문"
          },
          {
            "role": "M",
            "text": "in a spot"
          },
          {
            "role": "M",
            "text": "where the meaning barely shifts.",
            "note": "관계부사 where"
          }
        ],
        "grammar_note": "2형식 + 분사구문 (where 관계절)"
      },
      {
        "index": 6,
        "segments": [
          {
            "role": "S",
            "text": "The real effect of a mutation"
          },
          {
            "role": "V",
            "text": "depends"
          },
          {
            "role": "M",
            "text": "almost entirely on"
          },
          {
            "role": "M",
            "text": "where it falls and what it happens to touch.",
            "note": "where/what 명사절"
          }
        ],
        "grammar_note": "depend on + where/what 명사절"
      },
      {
        "index": 7,
        "segments": [
          {
            "role": "S",
            "text": "A change in a long, unused stretch of DNA"
          },
          {
            "role": "V",
            "text": "may quietly do"
          },
          {